{
  "task_id": "T-20260718090000-contract-ratification",
  "goal": "Ratify a domain-neutral task packet shape before downstream lifecycle tooling.",
  "non_goals": ["Implement routing or atomic state mutation."],
  "risk_inputs": {
    "ambiguity": 1,
    "change_scope": 2,
    "data_security": 0,
    "reversibility": 1,
    "impact": 2,
    "coordination": 1,
    "context_pressure": 1
  },
  "lane": "STANDARD",
  "risk_decision": {
    "router_version": 1,
    "total": 8,
    "score_lane": "STANDARD",
    "lane": "STANDARD",
    "promotion_reasons": [],
    "human_override_audit": null,
    "required_artifacts": ["brief_spec", "task_packet"],
    "required_gates": ["lint", "review", "test"],
    "policy_hashes": {
      "core": "6682efb57df8b3cd6335d60409c4493ac1b0d5eae401e1faeb46ede06a5ed2e3",
      "overlay": "44136fa355b3678a1146ad16f7e8649e94fb4fc21fe77e8310c060f61caaff8a",
      "effective": "3ff0a69eba1f9fc57008498fb63020495983462979fe14566a781720d2a958b0"
    },
    "overlay_provenance": null
  },
  "acceptance_criteria": [
    { "id": "AC-01", "description": "The task packet validates against all four contracts." }
  ],
  "constraints": [],
  "decision_refs": []
}
